{
  "$schema": "https://json-schema.org/draft/2020-12/schema",
  "$id": "https://captivity-reloaded.invalid/mod-api/v1/manifest.schema.json",
  "title": "Captivity Reloaded Mod Manifest",
  "description": "Authoring schema for Mod API v1 manifest.json files.",
  "x-stability": "stable",
  "type": "object",
  "additionalProperties": false,
  "required": [
    "schemaVersion",
    "id",
    "displayName",
    "version",
    "modApiVersion",
    "contentRoots"
  ],
  "properties": {
    "schemaVersion": { "const": 1, "x-stability": "stable" },
    "id": { "$ref": "#/$defs/packId", "x-stability": "stable" },
    "displayName": { "type": "string", "minLength": 1, "x-stability": "stable" },
    "version": { "$ref": "#/$defs/semanticVersion", "x-stability": "stable" },
    "modApiVersion": { "const": 1, "x-stability": "stable" },
    "authors": {
      "type": "array",
      "items": { "type": "string", "minLength": 1 },
      "x-stability": "stable"
    },
    "description": { "type": "string", "x-stability": "stable" },
    "previewImages": {
      "type": "array",
      "maxItems": 8,
      "uniqueItems": true,
      "x-stability": "stable",
      "items": {
        "type": "string",
        "minLength": 5,
        "pattern": "^(?!/)(?!.*(?:^|/)\\.\\.(?:/|$))(?!.*\\\\).+\\.[Pp][Nn][Gg]$"
      }
    },
    "dependencies": { "$ref": "#/$defs/dependencies", "x-stability": "stable" },
    "optionalDependencies": { "$ref": "#/$defs/dependencies", "x-stability": "stable" },
    "loadAfter": { "$ref": "#/$defs/packIdList", "x-stability": "stable" },
    "loadBefore": { "$ref": "#/$defs/packIdList", "x-stability": "stable" },
    "conflicts": { "$ref": "#/$defs/packIdList", "x-stability": "stable" },
    "overrides": {
      "type": "array",
      "uniqueItems": true,
      "items": { "$ref": "#/$defs/contentId" },
      "x-stability": "stable"
    },
    "priority": {
      "type": "integer",
      "minimum": -100000,
      "maximum": 100000,
      "default": 0,
      "x-stability": "stable"
    },
    "contentRoots": {
      "type": "array",
      "minItems": 1,
      "uniqueItems": true,
      "x-stability": "stable",
      "items": {
        "type": "string",
        "minLength": 1,
        "pattern": "^(?!/)(?!.*(?:^|/)\\.\\.(?:/|$))(?!.*\\\\).+$"
      }
    },
    "assetBundles": {
      "type": "array",
      "maxItems": 3,
      "uniqueItems": true,
      "x-stability": "experimental",
      "description": "Generated by Captivity Mod Packager. Do not author this field manually.",
      "items": { "$ref": "#/$defs/assetBundle" }
    }
  },
  "$defs": {
    "packId": {
      "type": "string",
      "pattern": "^[a-z0-9][a-z0-9._-]*$"
    },
    "contentId": {
      "type": "string",
      "maxLength": 160,
      "pattern": "^[a-z0-9][a-z0-9._-]*:[a-z0-9][a-z0-9-]*(?:/[a-z0-9][a-z0-9-]*)*$"
    },
    "semanticVersion": {
      "type": "string",
      "pattern": "^(0|[1-9][0-9]*)\\.(0|[1-9][0-9]*)\\.(0|[1-9][0-9]*)(?:-[0-9A-Za-z.-]+)?(?:\\+[0-9A-Za-z.-]+)?$"
    },
    "versionRange": {
      "type": "string",
      "pattern": "^(?:>=\\s*)?(0|[1-9][0-9]*)\\.(0|[1-9][0-9]*)\\.(0|[1-9][0-9]*)(?:-[0-9A-Za-z.-]+)?(?:\\+[0-9A-Za-z.-]+)?$"
    },
    "dependency": {
      "type": "object",
      "additionalProperties": false,
      "required": ["id", "version"],
      "properties": {
        "id": { "$ref": "#/$defs/packId" },
        "version": { "$ref": "#/$defs/versionRange" }
      }
    },
    "dependencies": {
      "type": "array",
      "items": { "$ref": "#/$defs/dependency" }
    },
    "assetBundle": {
      "type": "object",
      "additionalProperties": false,
      "required": ["platform", "path", "sha256", "sizeBytes"],
      "properties": {
        "platform": { "enum": ["windows", "android", "webgl"] },
        "path": {
          "type": "string",
          "pattern": "^bundles/(windows|android|webgl)/[^/]+\\.[Bb][Uu][Nn][Dd][Ll][Ee]$"
        },
        "sha256": { "type": "string", "pattern": "^[0-9a-fA-F]{64}$" },
        "sizeBytes": { "type": "integer", "minimum": 1, "maximum": 268435456 }
      }
    },
    "packIdList": {
      "type": "array",
      "uniqueItems": true,
      "items": { "$ref": "#/$defs/packId" }
    }
  }
}
