{
  "schemaVersion": 1,
  "id": "example.tiled-starter-kit",
  "displayName": "Tiled Starter Kit",
  "version": "1.1.0",
  "modApiVersion": 1,
  "authors": ["Your Name"],
  "description": "A finite orthogonal Tiled collision-layout starter pack.",
  "dependencies": [{ "id": "core", "version": ">=0.1.0" }],
  "contentRoots": ["content"]
}
