{
  "schemaVersion": 1,
  "id": "example.lab-coat-template",
  "displayName": "Lab Coat Template",
  "version": "1.0.0",
  "modApiVersion": 1,
  "authors": ["Your Name"],
  "description": "An inherited scientist/lab-coat set template.",
  "dependencies": [{ "id": "core", "version": ">=0.1.0" }],
  "contentRoots": ["content"]
}
