{
  "schemaVersion": 1,
  "id": "example.revolver-44-template",
  "displayName": "Revolver .44 Template",
  "version": "1.0.0",
  "modApiVersion": 1,
  "authors": ["Your Name"],
  "description": "An inherited multi-part revolver authoring template.",
  "dependencies": [{ "id": "core", "version": ">=0.1.0" }],
  "contentRoots": ["content"]
}
