{
  "schemaVersion": 1,
  "id": "example.hazmat-suit-template",
  "displayName": "Hazmat Suit Template",
  "version": "1.0.0",
  "modApiVersion": 1,
  "authors": ["Your Name"],
  "description": "A full-body inherited hazmat-suit template.",
  "dependencies": [{ "id": "core", "version": ">=0.1.0" }],
  "contentRoots": ["content"]
}
